{
  "$schema": "http://json-schema.org/draft-07/schema#",
  "$id": "schema/customers.schema.json",
  "title": "Customers",
  "description": "Shape contract for shared/data/customers.json. Generated by tools/studio/gen-schemas.mjs — edit the generator, not this file.",
  "type": "object",
  "required": [
    "customers",
    "patience",
    "version"
  ],
  "additionalProperties": false,
  "properties": {
    "$schema": {
      "type": "string"
    },
    "_comment": {
      "type": "string"
    },
    "customers": {
      "type": "array",
      "items": {
        "type": "object",
        "properties": {
          "allowsSpecificDoneness": {
            "type": "boolean"
          },
          "id": {
            "type": "string",
            "pattern": "^[a-z][a-z0-9_]*$"
          },
          "isVip": {
            "type": "boolean"
          },
          "itemsMax": {
            "type": "integer"
          },
          "itemsMin": {
            "type": "integer"
          },
          "look": {
            "type": "object",
            "properties": {
              "accessory": {
                "type": "string"
              },
              "hair": {
                "type": "string"
              },
              "outfit": {
                "type": "string"
              },
              "skin": {
                "type": "string",
                "pattern": "^#[0-9A-Fa-f]{6}$"
              },
              "tint": {
                "type": "string",
                "pattern": "^#[0-9A-Fa-f]{6}$"
              }
            },
            "required": [
              "accessory",
              "hair",
              "outfit",
              "skin",
              "tint"
            ]
          },
          "minRestaurant": {
            "type": "integer"
          },
          "nameKey": {
            "type": "string"
          },
          "patienceMultiplier": {
            "type": "number"
          },
          "personaKey": {
            "type": "string"
          },
          "tipMultiplier": {
            "type": "number"
          },
          "toleranceScale": {
            "type": "number"
          },
          "unusualOnly": {
            "type": "boolean"
          },
          "voiceSet": {
            "type": "string"
          },
          "weight": {
            "type": "integer"
          }
        },
        "required": [
          "allowsSpecificDoneness",
          "id",
          "itemsMax",
          "itemsMin",
          "look",
          "minRestaurant",
          "nameKey",
          "patienceMultiplier",
          "personaKey",
          "tipMultiplier",
          "toleranceScale",
          "voiceSet",
          "weight"
        ]
      },
      "minItems": 8,
      "description": "§8 content floor: at least 8 entries."
    },
    "patience": {
      "type": "object",
      "properties": {
        "baseSeconds": {
          "type": "integer"
        },
        "criticalThreshold": {
          "type": "number"
        },
        "leaveGraceSec": {
          "type": "number"
        },
        "minSeconds": {
          "type": "integer"
        },
        "perBiteSeconds": {
          "type": "integer"
        },
        "perItemSeconds": {
          "type": "integer"
        },
        "warningThreshold": {
          "type": "number"
        }
      },
      "required": [
        "baseSeconds",
        "criticalThreshold",
        "leaveGraceSec",
        "minSeconds",
        "perBiteSeconds",
        "perItemSeconds",
        "warningThreshold"
      ]
    },
    "version": {
      "type": "integer"
    }
  }
}
