{
  "$schema": "schema/customers.schema.json",
  "_comment": "Customer archetypes. patienceMultiplier scales the per-order patience budget; tipMultiplier scales coins; toleranceScale narrows the perfect window (harder).",
  "version": 2,
  "patience": {
    "baseSeconds": 26,
    "perItemSeconds": 12,
    "perBiteSeconds": 0,
    "minSeconds": 18,
    "warningThreshold": 0.35,
    "criticalThreshold": 0.15,
    "leaveGraceSec": 0.6
  },
  "customers": [
    {
      "id": "comum",
      "nameKey": "customer.comum.name",
      "personaKey": "customer.comum.persona",
      "weight": 30,
      "patienceMultiplier": 1.0,
      "tipMultiplier": 1.0,
      "toleranceScale": 1.0,
      "itemsMin": 1,
      "itemsMax": 2,
      "allowsSpecificDoneness": false,
      "minRestaurant": 0,
      "look": { "skin": "#C68642", "hair": "short", "outfit": "camiseta", "accessory": "none", "tint": "#4C86C6" },
      "voiceSet": "casual_m"
    },
    {
      "id": "apressado",
      "nameKey": "customer.apressado.name",
      "personaKey": "customer.apressado.persona",
      "weight": 16,
      "patienceMultiplier": 0.62,
      "tipMultiplier": 0.85,
      "toleranceScale": 1.05,
      "itemsMin": 1,
      "itemsMax": 1,
      "allowsSpecificDoneness": false,
      "minRestaurant": 0,
      "look": { "skin": "#8D5524", "hair": "cap", "outfit": "uniforme", "accessory": "cracha", "tint": "#E0B23C" },
      "voiceSet": "fast_m"
    },
    {
      "id": "familia",
      "nameKey": "customer.familia.name",
      "personaKey": "customer.familia.persona",
      "weight": 12,
      "patienceMultiplier": 1.25,
      "tipMultiplier": 1.1,
      "toleranceScale": 1.0,
      "itemsMin": 3,
      "itemsMax": 5,
      "allowsSpecificDoneness": false,
      "minRestaurant": 1,
      "look": { "skin": "#F1C27D", "hair": "bun", "outfit": "vestido", "accessory": "crianca", "tint": "#7FBF6A" },
      "voiceSet": "family"
    },
    {
      "id": "tio_do_churrasco",
      "nameKey": "customer.tio.name",
      "personaKey": "customer.tio.persona",
      "weight": 9,
      "patienceMultiplier": 0.9,
      "tipMultiplier": 1.3,
      "toleranceScale": 0.68,
      "itemsMin": 1,
      "itemsMax": 3,
      "allowsSpecificDoneness": true,
      "minRestaurant": 1,
      "look": { "skin": "#E0AC69", "hair": "bald_beard", "outfit": "camisa_aberta", "accessory": "oculos_sol", "tint": "#C0553B" },
      "voiceSet": "uncle"
    },
    {
      "id": "influencer",
      "nameKey": "customer.influencer.name",
      "personaKey": "customer.influencer.persona",
      "weight": 6,
      "patienceMultiplier": 0.8,
      "tipMultiplier": 2.2,
      "toleranceScale": 0.85,
      "itemsMin": 1,
      "itemsMax": 2,
      "allowsSpecificDoneness": true,
      "minRestaurant": 2,
      "look": { "skin": "#FFDBAC", "hair": "long", "outfit": "trendy", "accessory": "celular", "tint": "#D46FB0" },
      "voiceSet": "young_f"
    },
    {
      "id": "turista",
      "nameKey": "customer.turista.name",
      "personaKey": "customer.turista.persona",
      "weight": 7,
      "patienceMultiplier": 1.0,
      "tipMultiplier": 1.45,
      "toleranceScale": 1.1,
      "itemsMin": 1,
      "itemsMax": 3,
      "allowsSpecificDoneness": false,
      "unusualOnly": true,
      "minRestaurant": 2,
      "look": { "skin": "#F5D0B0", "hair": "hat", "outfit": "camisa_floral", "accessory": "camera", "tint": "#4FB8C4" },
      "voiceSet": "tourist"
    },
    {
      "id": "economico",
      "nameKey": "customer.economico.name",
      "personaKey": "customer.economico.persona",
      "weight": 12,
      "patienceMultiplier": 1.1,
      "tipMultiplier": 0.5,
      "toleranceScale": 1.1,
      "itemsMin": 1,
      "itemsMax": 1,
      "allowsSpecificDoneness": false,
      "minRestaurant": 0,
      "look": { "skin": "#A9713D", "hair": "gray_short", "outfit": "camiseta_lisa", "accessory": "sacola", "tint": "#9A9A9A" },
      "voiceSet": "casual_f"
    },
    {
      "id": "generoso",
      "nameKey": "customer.generoso.name",
      "personaKey": "customer.generoso.persona",
      "weight": 8,
      "patienceMultiplier": 1.0,
      "tipMultiplier": 2.0,
      "toleranceScale": 1.0,
      "itemsMin": 1,
      "itemsMax": 3,
      "allowsSpecificDoneness": false,
      "minRestaurant": 1,
      "look": { "skin": "#7A4A21", "hair": "curly", "outfit": "camisa_social", "accessory": "relogio", "tint": "#B79A4B" },
      "voiceSet": "warm_m"
    },
    {
      "id": "rival",
      "nameKey": "customer.rival.name",
      "personaKey": "customer.rival.persona",
      "weight": 4,
      "patienceMultiplier": 0.72,
      "tipMultiplier": 1.5,
      "toleranceScale": 0.6,
      "itemsMin": 2,
      "itemsMax": 3,
      "allowsSpecificDoneness": true,
      "minRestaurant": 3,
      "look": { "skin": "#C68642", "hair": "bandana", "outfit": "avental_couro", "accessory": "faca", "tint": "#8C3F2E" },
      "voiceSet": "rival"
    },
    {
      "id": "vip",
      "nameKey": "customer.vip.name",
      "personaKey": "customer.vip.persona",
      "weight": 0,
      "patienceMultiplier": 1.35,
      "tipMultiplier": 3.0,
      "toleranceScale": 0.8,
      "itemsMin": 2,
      "itemsMax": 4,
      "allowsSpecificDoneness": true,
      "isVip": true,
      "minRestaurant": 1,
      "look": { "skin": "#F1C27D", "hair": "elegant", "outfit": "terno", "accessory": "estrela", "tint": "#E7C24A" },
      "voiceSet": "vip"
    },
    {
      "id": "vizinho",
      "nameKey": "customer.vizinho.name",
      "personaKey": "customer.vizinho.persona",
      "weight": 10,
      "patienceMultiplier": 0.95,
      "tipMultiplier": 0.9,
      "toleranceScale": 1.0,
      "itemsMin": 1,
      "itemsMax": 2,
      "allowsSpecificDoneness": false,
      "minRestaurant": 0,
      "look": { "skin": "#E0AC69", "hair": "curly_short", "outfit": "regata", "accessory": "chinelo", "tint": "#6FA8C9" },
      "voiceSet": "casual_m"
    }
  ]
}
